{
  "asset_id": "CHK-SW-HX-07A",
  "window": {
    "start": "2025-03-12T08:00:00Z",
    "end": "2025-03-12T09:00:00Z"
  },
  "mode": "steady",
  "percent_rated_power": 100,
  "train_configuration": {
    "train_id": "Train-A",
    "in_service": true
  },
  "recent_operations": [
    {
      "timestamp": "2025-03-12T08:00:00Z",
      "action_type": "surveillance_test",
      "description": "Quarterly SW flow balance surveillance initiated per WO-2025-SW-0147. Full-power steady-state operation. No power reduction or load change during surveillance window.",
      "system_affected": "Service Water Train A",
      "procedure_ref": "WO-2025-SW-0147"
    }
  ],
  "nearby_maintenance": [
    {
      "wo_id": "WO-2025-SW-0147",
      "maintenance_type": "surveillance",
      "component_id": "CHK-SW-HX-07A",
      "proximity": "same_component",
      "completed_at": "2025-03-12T08:44:00Z"
    }
  ]
}